2026-01-12 11:58:06,092 - INFO - 🚀 Pipeline started in 'small' mode
2026-01-12 11:58:06,093 - INFO - ✅ Ingested CSV: audit_trail.csv
2026-01-12 11:58:06,093 - INFO - ✅ Moved to staging: 9c65d70f-b259-474a-a5d5-032195756598.csv
2026-01-12 11:58:06,093 - INFO - ✅ Read Log File: app_debug.log
2026-01-12 11:58:06,093 - INFO - ✅ Moved to staging: d08d2402-fc36-41f8-97be-c82af96b5b1d.log
2026-01-12 11:58:06,093 - INFO - ✅ Read Log File: system.log
2026-01-12 11:58:06,093 - INFO - ✅ Moved to staging: ad9ee0bd-8d7c-46a3-89a0-a0d12e9ae4b0.log
2026-01-12 11:58:06,095 - INFO - 🧠 Running LINE-LEVEL clustering (Best for single large logs)
2026-01-12 11:58:06,096 - INFO - ✅ Ingested CSV: 9c65d70f-b259-474a-a5d5-032195756598.csv
2026-01-12 11:58:06,096 - INFO - ✅ Read Log File: d08d2402-fc36-41f8-97be-c82af96b5b1d.log
2026-01-12 11:58:06,096 - INFO - ✅ Read Log File: ad9ee0bd-8d7c-46a3-89a0-a0d12e9ae4b0.log
2026-01-12 11:58:06,108 - INFO - 📊 Processed 3 files in LINE-LEVEL mode.
2026-01-13 15:43:02,874 - INFO - 🚀 Pipeline started in 'large' mode
2026-01-13 15:43:02,876 - INFO - ✅ Read Log File: ai.log
2026-01-13 15:43:02,876 - INFO - ✅ Moved to staging: 8530764a-4272-4aa5-9059-1c6f22cf7f99.log
2026-01-13 15:43:02,883 - INFO - 🚀 STARTING LARGE SCALE PIPELINE (Summarization + Sorting)
2026-01-13 15:43:02,883 - INFO - Initializing Optimized Keyword Summarizer (MMR) with: sentence-transformers/all-MiniLM-L6-v2
2026-01-13 15:43:02,900 - INFO - Use pytorch device_name: mps
2026-01-13 15:43:02,900 - INFO - Load pretrained SentenceTransformer: sentence-transformers/all-MiniLM-L6-v2
2026-01-13 15:43:07,947 - INFO - Use pytorch device_name: mps
2026-01-13 15:43:07,948 - INFO - Load pretrained SentenceTransformer: sentence-transformers/all-MiniLM-L6-v2
2026-01-13 15:43:12,626 - INFO - 🧠 Summarizing single file: 8530764a-4272-4aa5-9059-1c6f22cf7f99.log
2026-01-13 15:43:12,627 - INFO - ✅ Read Log File: 8530764a-4272-4aa5-9059-1c6f22cf7f99.log
2026-01-13 15:43:13,575 - INFO - ✅ Extracted Keywords: airportprocesscommand 466, faulted count, apple main, grunloop checkin, monitoring_period 15, scan o...
2026-01-13 15:43:13,575 - INFO -  Generating Embeddings for 1 files...
2026-01-13 15:43:13,736 - INFO - 📂 Organizing files into final categories...
2026-01-13 15:43:13,739 - INFO -    👉 Moved 8530764a-4272-4aa5-9059-1c6f22cf7f99.log -> system_log/
2026-01-13 15:43:13,739 - INFO - ✅ Cluster Report Saved: ./pipeline_data/processed/file_level_clusters.csv
2026-01-13 15:43:13,741 - INFO - 📊 Processed 1 files in LARGE-SCALE mode.
2026-01-13 19:01:22,918 - INFO - 🚀 Pipeline started in 'large' mode
2026-01-13 19:01:22,919 - INFO - ✅ Read Log File: ai.log
2026-01-13 19:01:22,920 - INFO - ✅ Moved to staging: fc7671ec-0c2d-49df-8fcb-ceb06a92823d.log
2026-01-13 19:01:23,244 - INFO - ✅ Ingested CSV: CIDDS-001-external-week1.csv
2026-01-13 19:01:23,245 - INFO - ✅ Moved to staging: 54c9c14a-8c5a-4f81-ac61-1ab067c972a9.csv
2026-01-13 19:01:23,245 - INFO - ✅ Read Log File: Apache_2k.log
2026-01-13 19:01:23,245 - INFO - ✅ Moved to staging: 4d63acd4-47c0-47e1-acfe-ba9e7f20442b.log
2026-01-13 19:01:23,249 - INFO - 🚀 STARTING LARGE SCALE PIPELINE (Summarization + Sorting)
2026-01-13 19:01:23,249 - INFO - Initializing Optimized Keyword Summarizer (MMR) with: sentence-transformers/all-MiniLM-L6-v2
2026-01-13 19:01:23,269 - INFO - Use pytorch device_name: mps
2026-01-13 19:01:23,269 - INFO - Load pretrained SentenceTransformer: sentence-transformers/all-MiniLM-L6-v2
2026-01-13 19:01:28,002 - INFO - Use pytorch device_name: mps
2026-01-13 19:01:28,002 - INFO - Load pretrained SentenceTransformer: sentence-transformers/all-MiniLM-L6-v2
2026-01-13 19:01:32,194 - INFO - 🧠 Summarizing 3 files using parallel processing...
2026-01-13 19:01:32,195 - INFO - ✅ Read Log File: 4d63acd4-47c0-47e1-acfe-ba9e7f20442b.log
2026-01-13 19:01:32,201 - INFO - ✅ Read Log File: fc7671ec-0c2d-49df-8fcb-ceb06a92823d.log
2026-01-13 19:01:32,520 - INFO - ✅ Ingested CSV: 54c9c14a-8c5a-4f81-ac61-1ab067c972a9.csv
2026-01-13 19:01:33,088 - INFO - ✅ Extracted Keywords: attackdescription data, tcp openstack_net, columns date, ap normal, duration proto, 57 172, flows fl...
2026-01-13 19:01:33,291 - INFO - ✅ Extracted Keywords: airportprocesscommand 466, faulted count, apple main, grunloop checkin, monitoring_period 15, scan o...
2026-01-13 19:01:33,291 - INFO - ✅ Extracted Keywords: notice jk2_init, child workerenv, scoreboard slot, error state, httpd conf, 2005 notice, index forbi...
2026-01-13 19:01:33,292 - INFO -  Generating Embeddings for 3 files...
2026-01-13 19:01:33,510 - INFO - 📂 Organizing files into final categories...
2026-01-13 19:01:33,510 - INFO -    👉 Moved 54c9c14a-8c5a-4f81-ac61-1ab067c972a9.csv -> system_log/
2026-01-13 19:01:33,511 - INFO -    👉 Moved 4d63acd4-47c0-47e1-acfe-ba9e7f20442b.log -> app_log/
2026-01-13 19:01:33,511 - INFO -    👉 Moved fc7671ec-0c2d-49df-8fcb-ceb06a92823d.log -> system_log/
2026-01-13 19:01:33,511 - INFO - ✅ Cluster Report Saved: ./pipeline_data/processed/file_level_clusters.csv
2026-01-13 19:01:33,774 - ERROR - ❌ RAG Indexing failed: `BaseSettings` has been moved to the `pydantic-settings` package. See https://docs.pydantic.dev/2.12/migration/#basesettings-has-moved-to-pydantic-settings for more details.

For further information visit https://errors.pydantic.dev/2.12/u/import-error
2026-01-13 19:01:33,776 - INFO - 📊 Processed 3 files in LARGE-SCALE mode.
2026-01-13 19:59:54,395 - INFO - 🚀 Pipeline started in 'large' mode
2026-01-13 19:59:54,395 - WARNING - ⚠️ No files found in ./pipeline_data/incoming.
2026-01-13 19:59:54,395 - INFO - 🚀 STARTING LARGE SCALE PIPELINE (Summarization + Sorting)
2026-01-13 19:59:54,395 - INFO - Initializing Optimized Keyword Summarizer (MMR) with: sentence-transformers/all-MiniLM-L6-v2
2026-01-13 19:59:54,411 - INFO - Use pytorch device_name: mps
2026-01-13 19:59:54,412 - INFO - Load pretrained SentenceTransformer: sentence-transformers/all-MiniLM-L6-v2
2026-01-13 19:59:58,345 - INFO - Use pytorch device_name: mps
2026-01-13 19:59:58,345 - INFO - Load pretrained SentenceTransformer: sentence-transformers/all-MiniLM-L6-v2
2026-01-13 20:00:02,022 - WARNING - ⚠️ No files found in staging to process.
2026-01-13 20:00:38,322 - INFO - 🚀 Pipeline started in 'large' mode
2026-01-13 20:00:38,322 - INFO - ✅ Read Log File: 4d63acd4-47c0-47e1-acfe-ba9e7f20442b.log
2026-01-13 20:00:38,322 - INFO - ✅ Moved to staging: 10a5e017-574e-4932-bd74-97daadad1491.log
2026-01-13 20:00:38,323 - INFO - ✅ Read Log File: fc7671ec-0c2d-49df-8fcb-ceb06a92823d.log
2026-01-13 20:00:38,323 - INFO - ✅ Moved to staging: 1c60dfaa-3a54-4763-b25a-a519a16d20cd.log
2026-01-13 20:00:38,328 - INFO - 🚀 STARTING LARGE SCALE PIPELINE (Summarization + Sorting)
2026-01-13 20:00:38,328 - INFO - Initializing Optimized Keyword Summarizer (MMR) with: sentence-transformers/all-MiniLM-L6-v2
2026-01-13 20:00:38,347 - INFO - Use pytorch device_name: mps
2026-01-13 20:00:38,347 - INFO - Load pretrained SentenceTransformer: sentence-transformers/all-MiniLM-L6-v2
2026-01-13 20:00:42,344 - INFO - Use pytorch device_name: mps
2026-01-13 20:00:42,344 - INFO - Load pretrained SentenceTransformer: sentence-transformers/all-MiniLM-L6-v2
2026-01-13 20:00:45,940 - INFO - 🧠 Summarizing 2 files using parallel processing...
2026-01-13 20:00:45,941 - INFO - ✅ Read Log File: 10a5e017-574e-4932-bd74-97daadad1491.log
2026-01-13 20:00:45,941 - INFO - ✅ Read Log File: 1c60dfaa-3a54-4763-b25a-a519a16d20cd.log
2026-01-13 20:00:46,991 - INFO - ✅ Extracted Keywords: notice jk2_init, child workerenv, scoreboard slot, error state, httpd conf, 2005 notice, index forbi...
2026-01-13 20:00:46,991 - INFO - ✅ Extracted Keywords: airportprocesscommand 466, faulted count, apple main, grunloop checkin, monitoring_period 15, scan o...
2026-01-13 20:00:46,991 - INFO -  Generating Embeddings for 2 files...
2026-01-13 20:00:47,037 - INFO - 📂 Organizing files into final categories...
2026-01-13 20:00:47,038 - INFO -    👉 Moved 10a5e017-574e-4932-bd74-97daadad1491.log -> app_log/
2026-01-13 20:00:47,039 - INFO -    👉 Moved 1c60dfaa-3a54-4763-b25a-a519a16d20cd.log -> system_log/
2026-01-13 20:00:47,040 - INFO - ✅ Cluster Report Saved: ./pipeline_data/processed/file_level_clusters.csv
2026-01-13 20:00:49,379 - INFO - 🧠 Indexing files into RAG Vector Store...
2026-01-13 20:00:49,379 - INFO - 💾 Initializing RAG Vector DB at ./chroma_db
2026-01-13 20:00:49,389 - INFO - Anonymized telemetry enabled. See                     https://docs.trychroma.com/telemetry for more information.
2026-01-13 20:00:50,281 - INFO - Use pytorch device_name: mps
2026-01-13 20:00:50,281 - INFO - Load pretrained SentenceTransformer: sentence-transformers/all-MiniLM-L6-v2
2026-01-13 20:00:54,130 - INFO -    Indexed summary for 10a5e017-574e-4932-bd74-97daadad1491.log
2026-01-13 20:00:54,189 - INFO -    Indexed summary for 1c60dfaa-3a54-4763-b25a-a519a16d20cd.log
2026-01-13 20:00:54,189 - INFO -    Start chunking and indexing full log content...
2026-01-13 20:00:54,189 - WARNING -    ⚠️ Could not chunk 10a5e017-574e-4932-bd74-97daadad1491.log: [Errno 2] No such file or directory: './pipeline_data/processed/staging/10a5e017-574e-4932-bd74-97daadad1491.log'
2026-01-13 20:00:54,190 - WARNING -    ⚠️ Could not chunk 1c60dfaa-3a54-4763-b25a-a519a16d20cd.log: [Errno 2] No such file or directory: './pipeline_data/processed/staging/1c60dfaa-3a54-4763-b25a-a519a16d20cd.log'
2026-01-13 20:00:54,190 - INFO - ✅ RAG Indexing Complete
2026-01-13 20:00:54,206 - INFO - 📊 Processed 2 files in LARGE-SCALE mode.
2026-01-13 20:01:45,215 - INFO - 🚀 Pipeline started in 'large' mode
2026-01-13 20:01:45,215 - INFO - ✅ Read Log File: 4d63acd4-47c0-47e1-acfe-ba9e7f20442b.log
2026-01-13 20:01:45,215 - INFO - ✅ Moved to staging: 4cb95f91-ba53-485f-a0d5-07b762ad3d53.log
2026-01-13 20:01:45,216 - INFO - ✅ Read Log File: 10a5e017-574e-4932-bd74-97daadad1491.log
2026-01-13 20:01:45,216 - INFO - ✅ Moved to staging: e2eea502-70bc-4f6f-8eb3-b429ba03fc01.log
2026-01-13 20:01:45,216 - INFO - ✅ Read Log File: fc7671ec-0c2d-49df-8fcb-ceb06a92823d.log
2026-01-13 20:01:45,216 - INFO - ✅ Moved to staging: 202b4c9a-9df0-48af-97c4-dd9fce1e717c.log
2026-01-13 20:01:45,217 - INFO - ✅ Read Log File: 1c60dfaa-3a54-4763-b25a-a519a16d20cd.log
2026-01-13 20:01:45,217 - INFO - ✅ Moved to staging: 0e0c40c6-980f-438a-bd7d-e156652bb2be.log
2026-01-13 20:01:45,225 - INFO - 🚀 STARTING LARGE SCALE PIPELINE (Summarization + Sorting)
2026-01-13 20:01:45,225 - INFO - Initializing Optimized Keyword Summarizer (MMR) with: sentence-transformers/all-MiniLM-L6-v2
2026-01-13 20:01:45,241 - INFO - Use pytorch device_name: mps
2026-01-13 20:01:45,241 - INFO - Load pretrained SentenceTransformer: sentence-transformers/all-MiniLM-L6-v2
2026-01-13 20:01:49,641 - INFO - Use pytorch device_name: mps
2026-01-13 20:01:49,641 - INFO - Load pretrained SentenceTransformer: sentence-transformers/all-MiniLM-L6-v2
2026-01-13 20:01:53,460 - INFO - 🧠 Summarizing 4 files using parallel processing...
2026-01-13 20:01:53,462 - INFO - ✅ Read Log File: e2eea502-70bc-4f6f-8eb3-b429ba03fc01.log
2026-01-13 20:01:53,462 - INFO - ✅ Read Log File: 4cb95f91-ba53-485f-a0d5-07b762ad3d53.log
2026-01-13 20:01:53,472 - INFO - ✅ Read Log File: 202b4c9a-9df0-48af-97c4-dd9fce1e717c.log
2026-01-13 20:01:53,477 - INFO - ✅ Read Log File: 0e0c40c6-980f-438a-bd7d-e156652bb2be.log
2026-01-13 20:01:54,816 - INFO - ✅ Extracted Keywords: notice jk2_init, child workerenv, scoreboard slot, error state, httpd conf, 2005 notice, index forbi...
2026-01-13 20:01:54,816 - INFO - ✅ Extracted Keywords: notice jk2_init, child workerenv, scoreboard slot, error state, httpd conf, 2005 notice, index forbi...
2026-01-13 20:01:54,821 - INFO - ✅ Extracted Keywords: airportprocesscommand 466, faulted count, apple main, grunloop checkin, monitoring_period 15, scan o...
2026-01-13 20:01:54,822 - INFO - ✅ Extracted Keywords: airportprocesscommand 466, faulted count, apple main, grunloop checkin, monitoring_period 15, scan o...
2026-01-13 20:01:54,822 - INFO -  Generating Embeddings for 4 files...
2026-01-13 20:01:55,210 - INFO - 📂 Organizing files into final categories...
2026-01-13 20:01:55,213 - INFO -    👉 Moved 4cb95f91-ba53-485f-a0d5-07b762ad3d53.log -> app_log/
2026-01-13 20:01:55,213 - INFO -    👉 Moved 0e0c40c6-980f-438a-bd7d-e156652bb2be.log -> system_log/
2026-01-13 20:01:55,213 - INFO -    👉 Moved 202b4c9a-9df0-48af-97c4-dd9fce1e717c.log -> system_log/
2026-01-13 20:01:55,213 - INFO -    👉 Moved e2eea502-70bc-4f6f-8eb3-b429ba03fc01.log -> app_log/
2026-01-13 20:01:55,214 - INFO - ✅ Cluster Report Saved: ./pipeline_data/processed/file_level_clusters.csv
2026-01-13 20:01:55,556 - INFO - 🧠 Indexing files into RAG Vector Store...
2026-01-13 20:01:55,556 - INFO - 💾 Initializing RAG Vector DB at ./chroma_db
2026-01-13 20:01:55,569 - INFO - Anonymized telemetry enabled. See                     https://docs.trychroma.com/telemetry for more information.
2026-01-13 20:01:55,660 - INFO - Use pytorch device_name: mps
2026-01-13 20:01:55,660 - INFO - Load pretrained SentenceTransformer: sentence-transformers/all-MiniLM-L6-v2
2026-01-13 20:01:59,432 - INFO -    Indexed summary for 4cb95f91-ba53-485f-a0d5-07b762ad3d53.log
2026-01-13 20:01:59,460 - INFO -    Indexed summary for 0e0c40c6-980f-438a-bd7d-e156652bb2be.log
2026-01-13 20:01:59,477 - INFO -    Indexed summary for 202b4c9a-9df0-48af-97c4-dd9fce1e717c.log
2026-01-13 20:01:59,484 - INFO -    Indexed summary for e2eea502-70bc-4f6f-8eb3-b429ba03fc01.log
2026-01-13 20:01:59,484 - INFO -    Start chunking and indexing full log content...
2026-01-13 20:02:00,692 - INFO -    Indexed 189 chunks for 4cb95f91-ba53-485f-a0d5-07b762ad3d53.log
2026-01-13 20:02:12,245 - INFO -    Indexed 2039 chunks for 0e0c40c6-980f-438a-bd7d-e156652bb2be.log
2026-01-13 20:02:24,195 - INFO -    Indexed 2039 chunks for 202b4c9a-9df0-48af-97c4-dd9fce1e717c.log
2026-01-13 20:02:25,326 - INFO -    Indexed 189 chunks for e2eea502-70bc-4f6f-8eb3-b429ba03fc01.log
2026-01-13 20:02:25,326 - INFO - ✅ RAG Indexing Complete
2026-01-13 20:02:25,333 - INFO - 📊 Processed 4 files in LARGE-SCALE mode.
2026-01-15 14:05:13,605 - INFO - 🚀 Pipeline started in 'large' mode
2026-01-15 14:05:13,605 - INFO - ✅ Read Log File: 4cb95f91-ba53-485f-a0d5-07b762ad3d53.log
2026-01-15 14:05:13,605 - INFO - ✅ Moved to staging: cff62d27-3174-4917-afe9-f4c0ed603cb5.log
2026-01-15 14:05:13,606 - INFO - ✅ Read Log File: 0e0c40c6-980f-438a-bd7d-e156652bb2be.log
2026-01-15 14:05:13,606 - INFO - ✅ Moved to staging: 39e18926-9902-4df8-99eb-9770e56cdee0.log
2026-01-15 14:05:13,722 - INFO - ✅ Ingested CSV: 54c9c14a-8c5a-4f81-ac61-1ab067c972a9.csv
2026-01-15 14:05:13,722 - INFO - ✅ Moved to staging: c410c75c-5db2-4f08-aebe-347e936173d7.csv
2026-01-15 14:05:13,723 - INFO - ✅ Read Log File: 202b4c9a-9df0-48af-97c4-dd9fce1e717c.log
2026-01-15 14:05:13,723 - INFO - ✅ Moved to staging: 3468909e-4997-4a9d-9b92-d530e4e0d50a.log
2026-01-15 14:05:13,723 - INFO - ✅ Read Log File: 4d63acd4-47c0-47e1-acfe-ba9e7f20442b.log
2026-01-15 14:05:13,723 - INFO - ✅ Moved to staging: 0abcd59b-3a60-4521-bd89-8d1db3bfc457.log
2026-01-15 14:05:13,723 - INFO - ✅ Read Log File: 10a5e017-574e-4932-bd74-97daadad1491.log
2026-01-15 14:05:13,723 - INFO - ✅ Moved to staging: 83176d8d-ffb8-4a1d-8a0b-b23090d792e4.log
2026-01-15 14:05:13,723 - INFO - ✅ Read Log File: e2eea502-70bc-4f6f-8eb3-b429ba03fc01.log
2026-01-15 14:05:13,723 - INFO - ✅ Moved to staging: 7882e849-849b-46ea-afaa-d76aa155f57f.log
2026-01-15 14:05:13,724 - INFO - ✅ Read Log File: fc7671ec-0c2d-49df-8fcb-ceb06a92823d.log
2026-01-15 14:05:13,724 - INFO - ✅ Moved to staging: 1562db33-98bd-477a-9830-df0232d1cd1d.log
2026-01-15 14:05:13,724 - INFO - ✅ Read Log File: 1c60dfaa-3a54-4763-b25a-a519a16d20cd.log
2026-01-15 14:05:13,724 - INFO - ✅ Moved to staging: d8f1de86-a631-4b9a-9241-cd6568911bfa.log
2026-01-15 14:05:13,732 - INFO - 🚀 STARTING LARGE SCALE PIPELINE (Summarization + Sorting)
2026-01-15 14:05:13,732 - INFO - Initializing Optimized Keyword Summarizer (MMR) with: sentence-transformers/all-MiniLM-L6-v2
2026-01-15 14:05:13,745 - INFO - Use pytorch device_name: mps
2026-01-15 14:05:13,745 - INFO - Load pretrained SentenceTransformer: sentence-transformers/all-MiniLM-L6-v2
2026-01-15 14:05:17,821 - INFO - Use pytorch device_name: mps
2026-01-15 14:05:17,821 - INFO - Load pretrained SentenceTransformer: sentence-transformers/all-MiniLM-L6-v2
2026-01-15 14:05:21,625 - INFO - 🧠 Summarizing 9 files using parallel processing...
2026-01-15 14:05:21,626 - INFO - ✅ Read Log File: 83176d8d-ffb8-4a1d-8a0b-b23090d792e4.log
2026-01-15 14:05:21,626 - INFO - ✅ Read Log File: 0abcd59b-3a60-4521-bd89-8d1db3bfc457.log
2026-01-15 14:05:21,644 - INFO - ✅ Read Log File: 7882e849-849b-46ea-afaa-d76aa155f57f.log
2026-01-15 14:05:21,657 - INFO - ✅ Read Log File: 1562db33-98bd-477a-9830-df0232d1cd1d.log
2026-01-15 14:05:21,678 - INFO - ✅ Read Log File: 39e18926-9902-4df8-99eb-9770e56cdee0.log
2026-01-15 14:05:21,683 - INFO - ✅ Read Log File: d8f1de86-a631-4b9a-9241-cd6568911bfa.log
2026-01-15 14:05:21,719 - INFO - ✅ Read Log File: cff62d27-3174-4917-afe9-f4c0ed603cb5.log
2026-01-15 14:05:21,744 - INFO - ✅ Read Log File: 3468909e-4997-4a9d-9b92-d530e4e0d50a.log
2026-01-15 14:05:22,496 - INFO - ✅ Ingested CSV: c410c75c-5db2-4f08-aebe-347e936173d7.csv
2026-01-15 14:05:23,075 - INFO - ✅ Extracted Keywords: Total Entries: 172838. Keywords: attackdescription data, tcp openstack_net, columns date, ap normal,...
2026-01-15 14:05:23,462 - INFO - ✅ Extracted Keywords: Total Entries: 2000. Keywords: notice jk2_init, child workerenv, scoreboard slot, error state, httpd...
2026-01-15 14:05:23,463 - INFO - ✅ Extracted Keywords: Total Entries: 2000. Keywords: notice jk2_init, child workerenv, scoreboard slot, error state, httpd...
2026-01-15 14:05:23,463 - INFO - ✅ Extracted Keywords: Total Entries: 2000. Keywords: notice jk2_init, child workerenv, scoreboard slot, error state, httpd...
2026-01-15 14:05:23,466 - INFO - ✅ Extracted Keywords: Total Entries: 2000. Keywords: notice jk2_init, child workerenv, scoreboard slot, error state, httpd...
2026-01-15 14:05:23,476 - INFO - ✅ Extracted Keywords: Total Entries: 8092. Keywords: airportprocesscommand 466, faulted count, apple main, grunloop checki...
2026-01-15 14:05:23,478 - INFO - ✅ Extracted Keywords: Total Entries: 8092. Keywords: airportprocesscommand 466, faulted count, apple main, grunloop checki...
2026-01-15 14:05:23,479 - INFO - ✅ Extracted Keywords: Total Entries: 8092. Keywords: airportprocesscommand 466, faulted count, apple main, grunloop checki...
2026-01-15 14:05:23,480 - INFO - ✅ Extracted Keywords: Total Entries: 8092. Keywords: airportprocesscommand 466, faulted count, apple main, grunloop checki...
2026-01-15 14:05:23,480 - INFO -  Generating Embeddings for 9 files...
2026-01-15 14:05:23,619 - INFO - 📂 Organizing files into final categories...
2026-01-15 14:05:23,621 - INFO -    👉 Moved 0abcd59b-3a60-4521-bd89-8d1db3bfc457.log -> app_log/
2026-01-15 14:05:23,621 - INFO -    👉 Moved 83176d8d-ffb8-4a1d-8a0b-b23090d792e4.log -> app_log/
2026-01-15 14:05:23,621 - INFO -    👉 Moved 7882e849-849b-46ea-afaa-d76aa155f57f.log -> app_log/
2026-01-15 14:05:23,621 - INFO -    👉 Moved 1562db33-98bd-477a-9830-df0232d1cd1d.log -> system_log/
2026-01-15 14:05:23,621 - INFO -    👉 Moved c410c75c-5db2-4f08-aebe-347e936173d7.csv -> system_log/
2026-01-15 14:05:23,621 - INFO -    👉 Moved 39e18926-9902-4df8-99eb-9770e56cdee0.log -> system_log/
2026-01-15 14:05:23,622 - INFO -    👉 Moved d8f1de86-a631-4b9a-9241-cd6568911bfa.log -> system_log/
2026-01-15 14:05:23,622 - INFO -    👉 Moved 3468909e-4997-4a9d-9b92-d530e4e0d50a.log -> system_log/
2026-01-15 14:05:23,622 - INFO -    👉 Moved cff62d27-3174-4917-afe9-f4c0ed603cb5.log -> app_log/
2026-01-15 14:05:23,623 - INFO - ✅ Cluster Report Saved: ./pipeline_data/processed/file_level_clusters.csv
2026-01-15 14:05:23,942 - INFO - 🧠 Indexing files into RAG Vector Store...
2026-01-15 14:05:23,942 - INFO - 💾 Initializing RAG Vector DB at ./chroma_db
2026-01-15 14:05:23,953 - INFO - Anonymized telemetry enabled. See                     https://docs.trychroma.com/telemetry for more information.
2026-01-15 14:05:24,022 - INFO - Use pytorch device_name: mps
2026-01-15 14:05:24,022 - INFO - Load pretrained SentenceTransformer: sentence-transformers/all-MiniLM-L6-v2
2026-01-15 14:05:27,963 - INFO -    Indexed summary for 0abcd59b-3a60-4521-bd89-8d1db3bfc457.log
2026-01-15 14:05:27,980 - INFO -    Indexed summary for 83176d8d-ffb8-4a1d-8a0b-b23090d792e4.log
2026-01-15 14:05:27,996 - INFO -    Indexed summary for 7882e849-849b-46ea-afaa-d76aa155f57f.log
2026-01-15 14:05:28,027 - INFO -    Indexed summary for 1562db33-98bd-477a-9830-df0232d1cd1d.log
2026-01-15 14:05:28,055 - INFO -    Indexed summary for c410c75c-5db2-4f08-aebe-347e936173d7.csv
2026-01-15 14:05:28,073 - INFO -    Indexed summary for 39e18926-9902-4df8-99eb-9770e56cdee0.log
2026-01-15 14:05:28,092 - INFO -    Indexed summary for d8f1de86-a631-4b9a-9241-cd6568911bfa.log
2026-01-15 14:05:28,110 - INFO -    Indexed summary for 3468909e-4997-4a9d-9b92-d530e4e0d50a.log
2026-01-15 14:05:28,125 - INFO -    Indexed summary for cff62d27-3174-4917-afe9-f4c0ed603cb5.log
2026-01-15 14:05:28,125 - INFO -    Start chunking and indexing full log content...
2026-01-15 14:05:29,330 - INFO -    Indexed 189 chunks for 0abcd59b-3a60-4521-bd89-8d1db3bfc457.log
2026-01-15 14:05:30,434 - INFO -    Indexed 189 chunks for 83176d8d-ffb8-4a1d-8a0b-b23090d792e4.log
2026-01-15 14:05:31,545 - INFO -    Indexed 189 chunks for 7882e849-849b-46ea-afaa-d76aa155f57f.log
2026-01-15 14:05:43,414 - INFO -    Indexed 2039 chunks for 1562db33-98bd-477a-9830-df0232d1cd1d.log
2026-01-15 14:07:57,812 - ERROR - ❌ Failed to index chunks for c410c75c-5db2-4f08-aebe-347e936173d7.csv: ValueError: Batch size of 24567 is greater than max batch size of 5461
2026-01-15 14:08:09,636 - INFO -    Indexed 2039 chunks for 39e18926-9902-4df8-99eb-9770e56cdee0.log
2026-01-15 14:08:21,551 - INFO -    Indexed 2039 chunks for d8f1de86-a631-4b9a-9241-cd6568911bfa.log
2026-01-15 14:08:33,405 - INFO -    Indexed 2039 chunks for 3468909e-4997-4a9d-9b92-d530e4e0d50a.log
2026-01-15 14:08:34,517 - INFO -    Indexed 189 chunks for cff62d27-3174-4917-afe9-f4c0ed603cb5.log
2026-01-15 14:08:34,518 - INFO - ✅ RAG Indexing Complete
2026-01-15 14:08:34,527 - INFO - 📊 Processed 9 files in LARGE-SCALE mode.
2026-01-15 14:13:34,196 - INFO - 🚀 Pipeline started in 'large' mode
2026-01-15 14:13:34,196 - WARNING - ⚠️ No files found in ./pipeline_data/incoming.
2026-01-15 14:13:34,196 - INFO - 🚀 STARTING LARGE SCALE PIPELINE (Summarization + Sorting)
2026-01-15 14:13:34,196 - INFO - Initializing Optimized Keyword Summarizer (MMR) with: sentence-transformers/all-MiniLM-L6-v2
2026-01-15 14:13:34,209 - INFO - Use pytorch device_name: mps
2026-01-15 14:13:34,209 - INFO - Load pretrained SentenceTransformer: sentence-transformers/all-MiniLM-L6-v2
2026-01-15 14:13:38,151 - INFO - Use pytorch device_name: mps
2026-01-15 14:13:38,151 - INFO - Load pretrained SentenceTransformer: sentence-transformers/all-MiniLM-L6-v2
2026-01-15 14:13:41,942 - WARNING - ⚠️ No files found in staging to process.
2026-01-15 14:15:19,728 - INFO - 🚀 Pipeline started in 'large' mode
2026-01-15 14:15:19,729 - INFO - ✅ Read Log File: 0abcd59b-3a60-4521-bd89-8d1db3bfc457.log
2026-01-15 14:15:19,729 - INFO - ✅ Moved to staging: 8bd23201-b2d0-4eae-815e-f77286af5713.log
2026-01-15 14:15:19,729 - INFO - ✅ Read Log File: 83176d8d-ffb8-4a1d-8a0b-b23090d792e4.log
2026-01-15 14:15:19,729 - INFO - ✅ Moved to staging: b512bffc-99ac-4de2-94ce-18e854e47a44.log
2026-01-15 14:15:19,730 - INFO - ✅ Read Log File: 7882e849-849b-46ea-afaa-d76aa155f57f.log
2026-01-15 14:15:19,730 - INFO - ✅ Moved to staging: 67c477db-1207-439c-9cee-7ce0f1ce430a.log
2026-01-15 14:15:19,731 - INFO - ✅ Read Log File: 1562db33-98bd-477a-9830-df0232d1cd1d.log
2026-01-15 14:15:19,731 - INFO - ✅ Moved to staging: ce9c41e5-4284-4021-af91-25daf604d715.log
2026-01-15 14:15:19,857 - INFO - ✅ Ingested CSV: c410c75c-5db2-4f08-aebe-347e936173d7.csv
2026-01-15 14:15:19,857 - INFO - ✅ Moved to staging: 9e04d2e6-c104-4dbb-bdda-933cd964de73.csv
2026-01-15 14:15:19,858 - INFO - ✅ Read Log File: 39e18926-9902-4df8-99eb-9770e56cdee0.log
2026-01-15 14:15:19,858 - INFO - ✅ Moved to staging: 2bdfa39e-02ad-4740-a30c-3926b4d15ccd.log
2026-01-15 14:15:19,859 - INFO - ✅ Read Log File: d8f1de86-a631-4b9a-9241-cd6568911bfa.log
2026-01-15 14:15:19,859 - INFO - ✅ Moved to staging: ee73c09a-7410-42d1-9a66-6cb01516025c.log
2026-01-15 14:15:19,860 - INFO - ✅ Read Log File: 3468909e-4997-4a9d-9b92-d530e4e0d50a.log
2026-01-15 14:15:19,861 - INFO - ✅ Moved to staging: cf7ee03b-4472-4467-a7fd-020840aa11b8.log
2026-01-15 14:15:19,861 - INFO - ✅ Read Log File: cff62d27-3174-4917-afe9-f4c0ed603cb5.log
2026-01-15 14:15:19,861 - INFO - ✅ Moved to staging: bc5841b7-3f2b-4cd4-9e21-8c559a5f694a.log
2026-01-15 14:15:19,869 - INFO - 🚀 STARTING LARGE SCALE PIPELINE (Summarization + Sorting)
2026-01-15 14:15:19,869 - INFO - Initializing Optimized Keyword Summarizer (MMR) with: sentence-transformers/all-MiniLM-L6-v2
2026-01-15 14:15:19,882 - INFO - Use pytorch device_name: mps
2026-01-15 14:15:19,882 - INFO - Load pretrained SentenceTransformer: sentence-transformers/all-MiniLM-L6-v2
2026-01-15 14:15:24,030 - INFO - Use pytorch device_name: mps
2026-01-15 14:15:24,030 - INFO - Load pretrained SentenceTransformer: sentence-transformers/all-MiniLM-L6-v2
2026-01-15 14:15:28,023 - INFO - 🧠 Summarizing 9 files using parallel processing...
2026-01-15 14:15:28,024 - INFO - ✅ Read Log File: 67c477db-1207-439c-9cee-7ce0f1ce430a.log
2026-01-15 14:15:28,031 - INFO - ✅ Read Log File: b512bffc-99ac-4de2-94ce-18e854e47a44.log
2026-01-15 14:15:28,038 - INFO - ✅ Read Log File: ce9c41e5-4284-4021-af91-25daf604d715.log
2026-01-15 14:15:28,048 - INFO - ✅ Read Log File: ee73c09a-7410-42d1-9a66-6cb01516025c.log
2026-01-15 14:15:28,083 - INFO - ✅ Read Log File: cf7ee03b-4472-4467-a7fd-020840aa11b8.log
2026-01-15 14:15:28,083 - INFO - ✅ Read Log File: 2bdfa39e-02ad-4740-a30c-3926b4d15ccd.log
2026-01-15 14:15:28,083 - INFO - ✅ Read Log File: 8bd23201-b2d0-4eae-815e-f77286af5713.log
2026-01-15 14:15:28,191 - INFO - ✅ Read Log File: bc5841b7-3f2b-4cd4-9e21-8c559a5f694a.log
2026-01-15 14:15:28,850 - INFO - ✅ Ingested CSV: 9e04d2e6-c104-4dbb-bdda-933cd964de73.csv
2026-01-15 14:15:29,435 - INFO - ✅ Extracted Keywords: Total Entries: 172838. Keywords: attackdescription data, tcp openstack_net, columns date, ap normal,...
2026-01-15 14:15:29,852 - INFO - ✅ Extracted Keywords: Total Entries: 2000. Keywords: notice jk2_init, child workerenv, scoreboard slot, error state, httpd...
2026-01-15 14:15:29,855 - INFO - ✅ Extracted Keywords: Total Entries: 2000. Keywords: notice jk2_init, child workerenv, scoreboard slot, error state, httpd...
2026-01-15 14:15:29,856 - INFO - ✅ Extracted Keywords: Total Entries: 2000. Keywords: notice jk2_init, child workerenv, scoreboard slot, error state, httpd...
2026-01-15 14:15:29,857 - INFO - ✅ Extracted Keywords: Total Entries: 2000. Keywords: notice jk2_init, child workerenv, scoreboard slot, error state, httpd...
2026-01-15 14:15:29,867 - INFO - ✅ Extracted Keywords: Total Entries: 8092. Keywords: airportprocesscommand 466, faulted count, apple main, grunloop checki...
2026-01-15 14:15:29,869 - INFO - ✅ Extracted Keywords: Total Entries: 8092. Keywords: airportprocesscommand 466, faulted count, apple main, grunloop checki...
2026-01-15 14:15:29,871 - INFO - ✅ Extracted Keywords: Total Entries: 8092. Keywords: airportprocesscommand 466, faulted count, apple main, grunloop checki...
2026-01-15 14:15:29,872 - INFO - ✅ Extracted Keywords: Total Entries: 8092. Keywords: airportprocesscommand 466, faulted count, apple main, grunloop checki...
2026-01-15 14:15:29,873 - INFO -  Generating Embeddings for 9 files...
2026-01-15 14:15:29,924 - INFO - 📂 Organizing files into final categories...
2026-01-15 14:15:29,924 - INFO -    👉 Moved b512bffc-99ac-4de2-94ce-18e854e47a44.log -> app_log/
2026-01-15 14:15:29,925 - INFO -    👉 Moved 67c477db-1207-439c-9cee-7ce0f1ce430a.log -> app_log/
2026-01-15 14:15:29,925 - INFO -    👉 Moved ce9c41e5-4284-4021-af91-25daf604d715.log -> system_log/
2026-01-15 14:15:29,925 - INFO -    👉 Moved ee73c09a-7410-42d1-9a66-6cb01516025c.log -> system_log/
2026-01-15 14:15:29,925 - INFO -    👉 Moved cf7ee03b-4472-4467-a7fd-020840aa11b8.log -> system_log/
2026-01-15 14:15:29,925 - INFO -    👉 Moved 2bdfa39e-02ad-4740-a30c-3926b4d15ccd.log -> system_log/
2026-01-15 14:15:29,925 - INFO -    👉 Moved 9e04d2e6-c104-4dbb-bdda-933cd964de73.csv -> system_log/
2026-01-15 14:15:29,925 - INFO -    👉 Moved 8bd23201-b2d0-4eae-815e-f77286af5713.log -> app_log/
2026-01-15 14:15:29,925 - INFO -    👉 Moved bc5841b7-3f2b-4cd4-9e21-8c559a5f694a.log -> app_log/
2026-01-15 14:15:29,926 - INFO - ✅ Cluster Report Saved: ./pipeline_data/processed/file_level_clusters.csv
2026-01-15 14:15:30,237 - INFO - 🧠 Indexing files into RAG Vector Store...
2026-01-15 14:15:30,237 - INFO - 💾 Initializing RAG Vector DB at ./chroma_db
2026-01-15 14:15:30,247 - INFO - Anonymized telemetry enabled. See                     https://docs.trychroma.com/telemetry for more information.
2026-01-15 14:15:30,310 - INFO - Use pytorch device_name: mps
2026-01-15 14:15:30,310 - INFO - Load pretrained SentenceTransformer: sentence-transformers/all-MiniLM-L6-v2
2026-01-15 14:15:34,162 - INFO -    Indexed summary for b512bffc-99ac-4de2-94ce-18e854e47a44.log
2026-01-15 14:15:34,179 - INFO -    Indexed summary for 67c477db-1207-439c-9cee-7ce0f1ce430a.log
2026-01-15 14:15:34,211 - INFO -    Indexed summary for ce9c41e5-4284-4021-af91-25daf604d715.log
2026-01-15 14:15:34,230 - INFO -    Indexed summary for ee73c09a-7410-42d1-9a66-6cb01516025c.log
2026-01-15 14:15:34,247 - INFO -    Indexed summary for cf7ee03b-4472-4467-a7fd-020840aa11b8.log
2026-01-15 14:15:34,265 - INFO -    Indexed summary for 2bdfa39e-02ad-4740-a30c-3926b4d15ccd.log
2026-01-15 14:15:34,294 - INFO -    Indexed summary for 9e04d2e6-c104-4dbb-bdda-933cd964de73.csv
2026-01-15 14:15:34,309 - INFO -    Indexed summary for 8bd23201-b2d0-4eae-815e-f77286af5713.log
2026-01-15 14:15:34,325 - INFO -    Indexed summary for bc5841b7-3f2b-4cd4-9e21-8c559a5f694a.log
2026-01-15 14:15:34,325 - INFO -    Start chunking and indexing full log content...
2026-01-15 14:15:35,601 - INFO -    Indexed batch 1 (189 chunks) for b512bffc-99ac-4de2-94ce-18e854e47a44.log
2026-01-15 14:15:35,602 - INFO -    Indexed total 189 chunks for b512bffc-99ac-4de2-94ce-18e854e47a44.log
2026-01-15 14:15:36,716 - INFO -    Indexed batch 1 (189 chunks) for 67c477db-1207-439c-9cee-7ce0f1ce430a.log
2026-01-15 14:15:36,716 - INFO -    Indexed total 189 chunks for 67c477db-1207-439c-9cee-7ce0f1ce430a.log
2026-01-15 14:15:48,983 - INFO -    Indexed batch 1 (2039 chunks) for ce9c41e5-4284-4021-af91-25daf604d715.log
2026-01-15 14:15:48,983 - INFO -    Indexed total 2039 chunks for ce9c41e5-4284-4021-af91-25daf604d715.log
2026-01-15 14:16:01,045 - INFO -    Indexed batch 1 (2039 chunks) for ee73c09a-7410-42d1-9a66-6cb01516025c.log
2026-01-15 14:16:01,045 - INFO -    Indexed total 2039 chunks for ee73c09a-7410-42d1-9a66-6cb01516025c.log
2026-01-15 14:16:13,064 - INFO -    Indexed batch 1 (2039 chunks) for cf7ee03b-4472-4467-a7fd-020840aa11b8.log
2026-01-15 14:16:13,064 - INFO -    Indexed total 2039 chunks for cf7ee03b-4472-4467-a7fd-020840aa11b8.log
2026-01-15 14:16:24,971 - INFO -    Indexed batch 1 (2039 chunks) for 2bdfa39e-02ad-4740-a30c-3926b4d15ccd.log
2026-01-15 14:16:24,971 - INFO -    Indexed total 2039 chunks for 2bdfa39e-02ad-4740-a30c-3926b4d15ccd.log
2026-01-15 14:16:53,775 - INFO -    Indexed batch 1 (5000 chunks) for 9e04d2e6-c104-4dbb-bdda-933cd964de73.csv
2026-01-15 14:17:22,587 - INFO -    Indexed batch 2 (5000 chunks) for 9e04d2e6-c104-4dbb-bdda-933cd964de73.csv
2026-01-15 14:17:51,336 - INFO -    Indexed batch 3 (5000 chunks) for 9e04d2e6-c104-4dbb-bdda-933cd964de73.csv
2026-01-15 14:18:20,207 - INFO -    Indexed batch 4 (5000 chunks) for 9e04d2e6-c104-4dbb-bdda-933cd964de73.csv
2026-01-15 14:18:46,704 - INFO -    Indexed batch 5 (4567 chunks) for 9e04d2e6-c104-4dbb-bdda-933cd964de73.csv
2026-01-15 14:18:46,704 - INFO -    Indexed total 24567 chunks for 9e04d2e6-c104-4dbb-bdda-933cd964de73.csv
2026-01-15 14:18:47,878 - INFO -    Indexed batch 1 (189 chunks) for 8bd23201-b2d0-4eae-815e-f77286af5713.log
2026-01-15 14:18:47,878 - INFO -    Indexed total 189 chunks for 8bd23201-b2d0-4eae-815e-f77286af5713.log
2026-01-15 14:18:48,955 - INFO -    Indexed batch 1 (189 chunks) for bc5841b7-3f2b-4cd4-9e21-8c559a5f694a.log
2026-01-15 14:18:48,955 - INFO -    Indexed total 189 chunks for bc5841b7-3f2b-4cd4-9e21-8c559a5f694a.log
2026-01-15 14:18:48,955 - INFO - ✅ RAG Indexing Complete
2026-01-15 14:18:48,965 - INFO - 📊 Processed 9 files in LARGE-SCALE mode.
2026-01-15 15:52:06,420 - INFO - 🚀 Pipeline started in 'large' mode
2026-01-15 15:52:06,421 - INFO - ✅ Read Log File: b512bffc-99ac-4de2-94ce-18e854e47a44.log
2026-01-15 15:52:06,421 - INFO - ✅ Moved to staging: db74938e-2fc1-4bec-9a40-786b3a0a955c.log
2026-01-15 15:52:06,421 - INFO - ✅ Read Log File: 67c477db-1207-439c-9cee-7ce0f1ce430a.log
2026-01-15 15:52:06,421 - INFO - ✅ Moved to staging: f0c454df-216f-423f-a7af-140c99aaf16b.log
2026-01-15 15:52:06,423 - INFO - ✅ Read Log File: ce9c41e5-4284-4021-af91-25daf604d715.log
2026-01-15 15:52:06,423 - INFO - ✅ Moved to staging: 6c54f02c-a85a-40cc-91e4-8a6331d5b7b0.log
2026-01-15 15:52:06,424 - INFO - ✅ Read Log File: ee73c09a-7410-42d1-9a66-6cb01516025c.log
2026-01-15 15:52:06,424 - INFO - ✅ Moved to staging: 12ec0ff3-c58b-4890-9110-9cdf61951e8a.log
2026-01-15 15:52:06,425 - INFO - ✅ Read Log File: cf7ee03b-4472-4467-a7fd-020840aa11b8.log
2026-01-15 15:52:06,425 - INFO - ✅ Moved to staging: 30f689ae-340e-4fbd-906a-f7eeac4014dd.log
2026-01-15 15:52:06,427 - INFO - ✅ Read Log File: 2bdfa39e-02ad-4740-a30c-3926b4d15ccd.log
2026-01-15 15:52:06,427 - INFO - ✅ Moved to staging: 77d44bdb-ef6b-490b-a973-15cafb93c59e.log
2026-01-15 15:52:06,553 - INFO - ✅ Ingested CSV: 9e04d2e6-c104-4dbb-bdda-933cd964de73.csv
2026-01-15 15:52:06,554 - INFO - ✅ Moved to staging: ff7847e3-7201-4a22-807f-0bf840e67475.csv
2026-01-15 15:52:06,554 - INFO - ✅ Read Log File: 8bd23201-b2d0-4eae-815e-f77286af5713.log
2026-01-15 15:52:06,554 - INFO - ✅ Moved to staging: 3b4c05c9-d4cd-4d46-a193-64b1b97e4305.log
2026-01-15 15:52:06,555 - INFO - ✅ Read Log File: bc5841b7-3f2b-4cd4-9e21-8c559a5f694a.log
2026-01-15 15:52:06,555 - INFO - ✅ Moved to staging: 374eac85-4ca0-4024-bd7d-2dc244c53c18.log
2026-01-15 15:52:06,563 - INFO - 🚀 STARTING LARGE SCALE PIPELINE (Summarization + Sorting)
2026-01-15 15:52:06,563 - INFO - Initializing Optimized Keyword Summarizer (MMR) with: sentence-transformers/all-MiniLM-L6-v2
2026-01-15 15:52:06,579 - INFO - Use pytorch device_name: mps
2026-01-15 15:52:06,579 - INFO - Load pretrained SentenceTransformer: sentence-transformers/all-MiniLM-L6-v2
2026-01-15 15:52:11,305 - INFO - Use pytorch device_name: mps
2026-01-15 15:52:11,305 - INFO - Load pretrained SentenceTransformer: sentence-transformers/all-MiniLM-L6-v2
2026-01-15 15:52:15,393 - INFO - 🧠 Summarizing 9 files using parallel processing...
2026-01-15 15:52:15,394 - INFO - ✅ Read Log File: 374eac85-4ca0-4024-bd7d-2dc244c53c18.log
2026-01-15 15:52:15,395 - INFO - ✅ Read Log File: db74938e-2fc1-4bec-9a40-786b3a0a955c.log
2026-01-15 15:52:15,411 - INFO - ✅ Read Log File: 3b4c05c9-d4cd-4d46-a193-64b1b97e4305.log
2026-01-15 15:52:15,411 - INFO - ✅ Read Log File: 6c54f02c-a85a-40cc-91e4-8a6331d5b7b0.log
2026-01-15 15:52:15,411 - INFO - ✅ Read Log File: 30f689ae-340e-4fbd-906a-f7eeac4014dd.log
2026-01-15 15:52:15,462 - INFO - ✅ Read Log File: f0c454df-216f-423f-a7af-140c99aaf16b.log
2026-01-15 15:52:15,462 - INFO - ✅ Read Log File: 12ec0ff3-c58b-4890-9110-9cdf61951e8a.log
2026-01-15 15:52:15,574 - INFO - ✅ Read Log File: 77d44bdb-ef6b-490b-a973-15cafb93c59e.log
2026-01-15 15:52:16,193 - INFO - ✅ Ingested CSV: ff7847e3-7201-4a22-807f-0bf840e67475.csv
2026-01-15 15:52:16,834 - INFO - ✅ Extracted Keywords: Total Entries: 172838. Keywords: attackdescription data, tcp openstack_net, columns date, ap normal,...
2026-01-15 15:52:17,233 - INFO - ✅ Extracted Keywords: Total Entries: 2000. Keywords: notice jk2_init, child workerenv, scoreboard slot, error state, httpd...
2026-01-15 15:52:17,235 - INFO - ✅ Extracted Keywords: Total Entries: 2000. Keywords: notice jk2_init, child workerenv, scoreboard slot, error state, httpd...
2026-01-15 15:52:17,235 - INFO - ✅ Extracted Keywords: Total Entries: 2000. Keywords: notice jk2_init, child workerenv, scoreboard slot, error state, httpd...
2026-01-15 15:52:17,237 - INFO - ✅ Extracted Keywords: Total Entries: 2000. Keywords: notice jk2_init, child workerenv, scoreboard slot, error state, httpd...
2026-01-15 15:52:17,247 - INFO - ✅ Extracted Keywords: Total Entries: 8092. Keywords: airportprocesscommand 466, faulted count, apple main, grunloop checki...
2026-01-15 15:52:17,248 - INFO - ✅ Extracted Keywords: Total Entries: 8092. Keywords: airportprocesscommand 466, faulted count, apple main, grunloop checki...
2026-01-15 15:52:17,249 - INFO - ✅ Extracted Keywords: Total Entries: 8092. Keywords: airportprocesscommand 466, faulted count, apple main, grunloop checki...
2026-01-15 15:52:17,250 - INFO - ✅ Extracted Keywords: Total Entries: 8092. Keywords: airportprocesscommand 466, faulted count, apple main, grunloop checki...
2026-01-15 15:52:17,251 - INFO -  Generating Embeddings for 9 files...
2026-01-15 15:52:17,301 - INFO - 📂 Organizing files into final categories...
2026-01-15 15:52:17,302 - INFO -    👉 Moved 374eac85-4ca0-4024-bd7d-2dc244c53c18.log -> app_log/
2026-01-15 15:52:17,302 - INFO -    👉 Moved db74938e-2fc1-4bec-9a40-786b3a0a955c.log -> app_log/
2026-01-15 15:52:17,303 - INFO -    👉 Moved 30f689ae-340e-4fbd-906a-f7eeac4014dd.log -> system_log/
2026-01-15 15:52:17,303 - INFO -    👉 Moved ff7847e3-7201-4a22-807f-0bf840e67475.csv -> system_log/
2026-01-15 15:52:17,303 - INFO -    👉 Moved 6c54f02c-a85a-40cc-91e4-8a6331d5b7b0.log -> system_log/
2026-01-15 15:52:17,303 - INFO -    👉 Moved 3b4c05c9-d4cd-4d46-a193-64b1b97e4305.log -> app_log/
2026-01-15 15:52:17,303 - INFO -    👉 Moved 12ec0ff3-c58b-4890-9110-9cdf61951e8a.log -> system_log/
2026-01-15 15:52:17,303 - INFO -    👉 Moved f0c454df-216f-423f-a7af-140c99aaf16b.log -> app_log/
2026-01-15 15:52:17,303 - INFO -    👉 Moved 77d44bdb-ef6b-490b-a973-15cafb93c59e.log -> system_log/
2026-01-15 15:52:17,304 - INFO - ✅ Cluster Report Saved: ./pipeline_data/processed/file_level_clusters.csv
2026-01-15 15:52:17,603 - INFO - 🧠 Indexing files into RAG Vector Store...
2026-01-15 15:52:17,603 - INFO - 💾 Initializing RAG Vector DB at ./chroma_db
2026-01-15 15:52:17,612 - INFO - Anonymized telemetry enabled. See                     https://docs.trychroma.com/telemetry for more information.
2026-01-15 15:52:17,682 - INFO - Use pytorch device_name: mps
2026-01-15 15:52:17,682 - INFO - Load pretrained SentenceTransformer: sentence-transformers/all-MiniLM-L6-v2
2026-01-15 15:52:21,790 - INFO -    Indexed summary for 374eac85-4ca0-4024-bd7d-2dc244c53c18.log
2026-01-15 15:52:21,808 - INFO -    Indexed summary for db74938e-2fc1-4bec-9a40-786b3a0a955c.log
2026-01-15 15:52:21,841 - INFO -    Indexed summary for 30f689ae-340e-4fbd-906a-f7eeac4014dd.log
2026-01-15 15:52:21,870 - INFO -    Indexed summary for ff7847e3-7201-4a22-807f-0bf840e67475.csv
2026-01-15 15:52:21,888 - INFO -    Indexed summary for 6c54f02c-a85a-40cc-91e4-8a6331d5b7b0.log
2026-01-15 15:52:21,904 - INFO -    Indexed summary for 3b4c05c9-d4cd-4d46-a193-64b1b97e4305.log
2026-01-15 15:52:21,924 - INFO -    Indexed summary for 12ec0ff3-c58b-4890-9110-9cdf61951e8a.log
2026-01-15 15:52:21,941 - INFO -    Indexed summary for f0c454df-216f-423f-a7af-140c99aaf16b.log
2026-01-15 15:52:21,969 - INFO -    Indexed summary for 77d44bdb-ef6b-490b-a973-15cafb93c59e.log
2026-01-15 15:52:21,969 - INFO -    Start chunking and indexing full log content...
2026-01-15 15:52:23,320 - INFO -    Indexed batch 1 (189 chunks) for 374eac85-4ca0-4024-bd7d-2dc244c53c18.log
2026-01-15 15:52:23,320 - INFO -    Indexed total 189 chunks for 374eac85-4ca0-4024-bd7d-2dc244c53c18.log
2026-01-15 15:52:24,446 - INFO -    Indexed batch 1 (189 chunks) for db74938e-2fc1-4bec-9a40-786b3a0a955c.log
2026-01-15 15:52:24,446 - INFO -    Indexed total 189 chunks for db74938e-2fc1-4bec-9a40-786b3a0a955c.log
2026-01-15 15:52:37,001 - INFO -    Indexed batch 1 (2039 chunks) for 30f689ae-340e-4fbd-906a-f7eeac4014dd.log
2026-01-15 15:52:37,001 - INFO -    Indexed total 2039 chunks for 30f689ae-340e-4fbd-906a-f7eeac4014dd.log
2026-01-15 15:53:07,045 - INFO -    Indexed batch 1 (5000 chunks) for ff7847e3-7201-4a22-807f-0bf840e67475.csv
2026-01-15 15:53:36,614 - INFO -    Indexed batch 2 (5000 chunks) for ff7847e3-7201-4a22-807f-0bf840e67475.csv
2026-01-15 15:54:05,906 - INFO -    Indexed batch 3 (5000 chunks) for ff7847e3-7201-4a22-807f-0bf840e67475.csv
2026-01-15 15:54:35,444 - INFO -    Indexed batch 4 (5000 chunks) for ff7847e3-7201-4a22-807f-0bf840e67475.csv
2026-01-15 15:55:03,235 - INFO -    Indexed batch 5 (4567 chunks) for ff7847e3-7201-4a22-807f-0bf840e67475.csv
2026-01-15 15:55:03,236 - INFO -    Indexed total 24567 chunks for ff7847e3-7201-4a22-807f-0bf840e67475.csv
2026-01-15 15:55:16,162 - INFO -    Indexed batch 1 (2039 chunks) for 6c54f02c-a85a-40cc-91e4-8a6331d5b7b0.log
2026-01-15 15:55:16,163 - INFO -    Indexed total 2039 chunks for 6c54f02c-a85a-40cc-91e4-8a6331d5b7b0.log
2026-01-15 15:55:17,321 - INFO -    Indexed batch 1 (189 chunks) for 3b4c05c9-d4cd-4d46-a193-64b1b97e4305.log
2026-01-15 15:55:17,321 - INFO -    Indexed total 189 chunks for 3b4c05c9-d4cd-4d46-a193-64b1b97e4305.log
2026-01-15 15:55:29,669 - INFO -    Indexed batch 1 (2039 chunks) for 12ec0ff3-c58b-4890-9110-9cdf61951e8a.log
2026-01-15 15:55:29,670 - INFO -    Indexed total 2039 chunks for 12ec0ff3-c58b-4890-9110-9cdf61951e8a.log
2026-01-15 15:55:30,788 - INFO -    Indexed batch 1 (189 chunks) for f0c454df-216f-423f-a7af-140c99aaf16b.log
2026-01-15 15:55:30,788 - INFO -    Indexed total 189 chunks for f0c454df-216f-423f-a7af-140c99aaf16b.log
2026-01-15 15:55:43,088 - INFO -    Indexed batch 1 (2039 chunks) for 77d44bdb-ef6b-490b-a973-15cafb93c59e.log
2026-01-15 15:55:43,089 - INFO -    Indexed total 2039 chunks for 77d44bdb-ef6b-490b-a973-15cafb93c59e.log
2026-01-15 15:55:43,089 - INFO - ✅ RAG Indexing Complete
2026-01-15 15:55:43,100 - INFO - 📊 Processed 9 files in LARGE-SCALE mode.
